{
  "id": "webxr_hand_25",
  "display_name": "WebXR Hand Input (25 joints, XRHand)",
  "kind": "hand",
  "status": "experimental",
  "joint_count": 25,
  "joint_names": [
    "wrist",
    "thumb_metacarpal",
    "thumb_phalanx_proximal",
    "thumb_phalanx_distal",
    "thumb_tip",
    "index_finger_metacarpal",
    "index_finger_phalanx_proximal",
    "index_finger_phalanx_intermediate",
    "index_finger_phalanx_distal",
    "index_finger_tip",
    "middle_finger_metacarpal",
    "middle_finger_phalanx_proximal",
    "middle_finger_phalanx_intermediate",
    "middle_finger_phalanx_distal",
    "middle_finger_tip",
    "ring_finger_metacarpal",
    "ring_finger_phalanx_proximal",
    "ring_finger_phalanx_intermediate",
    "ring_finger_phalanx_distal",
    "ring_finger_tip",
    "pinky_finger_metacarpal",
    "pinky_finger_phalanx_proximal",
    "pinky_finger_phalanx_intermediate",
    "pinky_finger_phalanx_distal",
    "pinky_finger_tip"
  ],
  "parents": [
    -1,
    0, 1, 2, 3,
    0, 5, 6, 7, 8,
    0, 10, 11, 12, 13,
    0, 15, 16, 17, 18,
    0, 20, 21, 22, 23
  ],
  "has_orientation": true,
  "length_unit": "m",
  "source_spec": "https://www.w3.org/TR/webxr-hand-input-1/",
  "notes": "status=experimental — pending confirmation against Eidolon's actual C2 output (C11 / Parthenon#47). This is openxr_hand_26 without the 'palm' joint; joint names are the XRHandJoint enum with hyphens normalised to underscores. Per-joint orientation is available from XRJointPose and SHOULD be carried in observation.hand.<side>.rot."
}
