{
  "id": "openxr_hand_26",
  "display_name": "OpenXR Hand Tracking (26 joints, XR_EXT_hand_tracking)",
  "kind": "hand",
  "status": "experimental",
  "joint_count": 26,
  "joint_names": [
    "palm",
    "wrist",
    "thumb_metacarpal",
    "thumb_proximal",
    "thumb_distal",
    "thumb_tip",
    "index_metacarpal",
    "index_proximal",
    "index_intermediate",
    "index_distal",
    "index_tip",
    "middle_metacarpal",
    "middle_proximal",
    "middle_intermediate",
    "middle_distal",
    "middle_tip",
    "ring_metacarpal",
    "ring_proximal",
    "ring_intermediate",
    "ring_distal",
    "ring_tip",
    "little_metacarpal",
    "little_proximal",
    "little_intermediate",
    "little_distal",
    "little_tip"
  ],
  "parents": [
    -1, 0,
    1, 2, 3, 4,
    1, 6, 7, 8, 9,
    1, 11, 12, 13, 14,
    1, 16, 17, 18, 19,
    1, 21, 22, 23, 24
  ],
  "has_orientation": true,
  "length_unit": "m",
  "source_spec": "https://registry.khronos.org/OpenXR/specs/1.1/html/xrspec.html#XR_EXT_hand_tracking",
  "notes": "status=experimental — pending confirmation against Eidolon's actual runtime output (C11 / Parthenon#47). Joint order mirrors XrHandJointEXT (XR_HAND_JOINT_COUNT_EXT = 26). Sources with per-joint orientation SHOULD fill observation.hand.<side>.rot; retargeting (xMimic-class work) consumes orientation, so down-projecting to mediapipe_hand_21 is lossy — it drops the palm joint, all metacarpals, and every orientation."
}
